Sentence,Score,Stopword
મને નથી લાગતું કે હું ક્યારેય કોઈ ફિલ્મમાં ગયો હોઉં અને તેને આટલો નાપસંદ કર્યો હોય,0,
હું ચોક્કસપણે આ ભેદનો અર્થ સારી રીતે નથી કરતો,0,
હું આનો અર્થ ભયંકર રીતે કરું છું,0,
આ ફિલ્મમાં કોઈ રિડીમિંગ ફીચર્સ નથી,0,
બધું જ ભયાનક છે,0,
વાર્તા મૂર્ખતાની બહાર છે,0,
બાળકો હેરાન કરે છે,0,
મુખ્ય માણસ કરિશ્મા-મુક્ત છે,0,
"કોઈપણ સ્તરે યોગ્યતા વિના સંપૂર્ણપણે, આ ત્રાસ સમાન છે",0,
હું તેને ફરીથી કહીશ પણ આ ત્રાસ છે,0,
કદાચ આ અત્યાચાર માટે વાજબી સમજૂતી હશે,0,
સ્વ-શોધની સુખદ સફર નથી,0,
અત્યંત અનિચ્છનીય,0,
"જો આ આધાર મૂર્ખ લાગે છે, તો તે એટલા માટે છે કારણ કે તે છે",0,
"હા, તે ખરાબ છે",0,
ભલામણ કરવા માટે કંઈ જ નથી,0,
"આ મૂવી લેખનને કારણે સહન કરી, તેને વધુ સસ્પેન્સની જરૂર હતી",0,
ઘણા બધા ક્લોઝ અપ્સ હતા,0,
પરંતુ તે સિવાય મૂવી ખેંચી જતી હતી અને હીરો ખરેખર તેમની સ્વતંત્રતા માટે કામ કરતા ન હતા,0,
પરંતુ આ મૂવી ચોક્કસપણે સરેરાશથી ઓછું ભાડું છે,0,
આ ફિલ્મ ખરાબ છે,0,
જેથી ખરાબ,0,
ફિલ્મ ઘણી લાંબી છે,0,
આ ચોક્કસપણે ખરાબ મુદ્દાઓ પૈકી એક છે,0,
મને જે ફિલ્મ મળી હતી તે તેની ઉંમર માટે સારી ગુણવત્તાવાળી ફિલ્મ હતી,1,
જ્હોન વેને મૂવી ઇન્ડસ્ટ્રીમાં આટલા યુવાન હોવા બદલ અકલ્પનીય કામ કર્યું,1,
મને લાગે છે કે જોન વેઇનની જૂની ફિલ્મ જોવી જ જોઈએ,1,
હું ખરેખર જોતો નથી કે કોઈ આ મૂવી કેવી રીતે માણી શકે,0,
મને નથી લાગતું કે જંકના આ સ્વ-આનંદી ભાગ જેટલી કંટાળાજનક ફિલ્મ મેં ક્યારેય જોઈ હોય,0,
"કદાચ તે વધુ સારું હોત જો દિગ્દર્શકે ફિલ્મનો મોટાભાગનો ભાગ તેની પોતાની આર્ટ વર્ક દર્શાવવામાં ન ખર્ચ્યો હોત, જે ખરેખર તેટલી નોંધપાત્ર નથી",0,
"બીજી વસ્તુ જે મને ખરેખર ગમતી ન હતી તે એ છે કે જ્યારે કોઈ પાત્રના ચહેરા પર મુક્કો મારવામાં આવે છે, ત્યારે તરત જ એક ગેલન લોહી વહેતું હતું",0,
તેનું પ્રદર્શન ફક્ત જીનિયસ છે,1,
પોપડો સારો નથી,0,
સ્વાદિષ્ટ નથી અને રચના માત્ર બીભત્સ હતી,0,
રિક સ્ટીવની ભલામણથી મે મહિનાના અંતમાં બેંક રજાઓ દરમિયાન રોકાયા અને તેને ગમ્યું,1,
મેનુ પર પસંદગી મહાન હતી અને તેથી કિંમતો હતી,1,
હવે હું ગુસ્સે થઈ રહ્યો છું અને મને મારો ડામ ફો જોઈએ છે,0,
પ્રામાણિકતા તે તાજા સ્વાદ ન હતી,0,
બટાકા રબર જેવા હતા અને તમે કહી શકો કે તેઓ ગરમ પાણીની નીચે રાખવામાં આવે તે પહેલાં જ બનેલા હતા,0,
ફ્રાઈસ પણ મહાન હતા,1,
એક મહાન સ્પર્શ,1,
સેવા ખૂબ જ ઝડપી હતી,1,
પાછા ન જતા,0,
કેશિયરને કોઈ પરવા નહોતી કે મારે શું કહેવું છે તે હજી પણ વધુ પડતી કિંમતમાં સમાપ્ત થઈ ગયું છે,0,
હું નારાજ હતો કારણ કે મને ખાતરી હતી કે તે માનવ વાળ છે,0,
હું ચોંકી ગયો હતો કારણ કે કોઈ ચિહ્નો માત્ર રોકડ સૂચવે છે,0,
ખૂબ આગ્રહણીય,1,
વેઇટ્રેસ સેવામાં થોડી ધીમી હતી,0,
"આ સ્થાન તમારા સમય માટે યોગ્ય નથી, વેગાસને એકલા દો",0,
બિલકુલ ન ગમ્યું,0,
"ખોરાક, અમેઝિંગ",1,
સેવા પણ સુંદર છે,1,
તેથી તેઓએ પ્રદર્શન કર્યું,1,
#NAME?,0,
દિવાલના આ છિદ્રમાં મહાન મેક્સીકન સ્ટ્રીટ ટેકોઝ અને મૈત્રીપૂર્ણ સ્ટાફ છે,1,
"અમારું ભોજન મેળવવા માટે એક કલાકનો સમય લાગ્યો રેસ્ટોરન્ટમાં ફક્ત 4 ટેબલ મારો ખોરાક લ્યુક ગરમ હતો, અમારું વિચ્છેદ આજુબાજુ ચાલી રહ્યું હતું જેમ કે તે સંપૂર્ણપણે ભરાઈ ગયો હતો",0,
સૌથી ખરાબ સૅલ્મોન સાશિમી હતું,0,
"ઉપરાંત 23 માટે બર્ગર, ફ્રાઈસ અને બીયર જેવા કોમ્બોઝ છે જે એક યોગ્ય ડીલ છે",1,
મને આ સ્થળ અકસ્માતે મળ્યું અને હું ખુશ થઈ શક્યો નહીં,1,
"કેટલાક પરિચિત પબ ફૂડનો ડંખ લેવા માટે એક સારી ઝડપી જગ્યા જેવું લાગે છે, પરંતુ તમારી તરફેણ કરો અને બીજે જુઓ",0,
"એકંદરે, મને આ સ્થાન ખૂબ ગમે છે",1,
રેસ્ટોરન્ટની એકમાત્ર રિડીમિંગ ગુણવત્તા એ હતી કે તે ખૂબ સસ્તું હતું,1,
પૂરતા ભાગો અને સારી કિંમતો,1,
"નબળી સેવા, વેઈટરે જ્યારે પણ તે ટેબલ પર આવે ત્યારે હું મૂર્ખ હતો તેવું મને અનુભવ્યું",0,
સેવા sucks,0,
ઝીંગા ટેન્ડર અને ભેજવાળી,1,
મને ફરીથી તે સંસ્થામાં ખેંચી જાય તેટલો સારો સોદો નથી,0,
આ બાજુઓ સારી હતી કે કેમ તે નક્કી કરવું મુશ્કેલ છે કારણ કે અમે ઓગળેલા સ્ટાયરોફોમથી કચડી ગયા હતા અને બીમાર થવાના ડરથી અમે તેને ખાવા માંગતા ન હતા,0,
"સકારાત્મક નોંધ પર, અમારું સર્વર ખૂબ જ સચેત હતું અને શ્રેષ્ઠ સેવા પ્રદાન કરે છે",1,
"રજીસ્ટર પાછળ કેટલાક ખરાબ લોકો સાથે, અણગમાના થીજી ગયેલા પક્સ",0,
મને ગમતી એકમાત્ર વસ્તુ પ્રાઇમ રીબ અને ડેઝર્ટ વિભાગ હતી,1,
તે ખૂબ જ ખરાબ છે કે ખોરાક ખૂબ જ સામાન્ય છે,0,
"બર્ગર સારું બીફ છે, બરાબર રાંધવામાં આવે છે",1,
"ગ્રીક ડ્રેસિંગ સાથે મારી બાજુનું ગ્રીક સલાડ ખૂબ જ સ્વાદિષ્ટ હતું, અને પિટા અને હમસ ખૂબ જ તાજું હતું",1,
અમે દુર્લભ બતકનો ઓર્ડર આપ્યો હતો અને તે અંદરથી ગુલાબી અને ટેન્ડર હતું અને બહારથી સરસ ચાર હતું,1,
જ્યારે તેમને ખબર પડી કે મારા પતિએ તેમના સનગ્લાસ ટેબલ પર મૂકી દીધા છે ત્યારે તે અમારી પાછળ દોડી આવ્યા હતા,1,
"તેઓ ગ્રાહકો પ્રત્યે ભયાનક વલણ ધરાવે છે, અને જ્યારે ગ્રાહકો તેમના ભોજનનો આનંદ લેતા નથી ત્યારે દરેક સાથે વાત કરે છે",0,
ડાઉનટાઉન વેગાસમાં હાર્ટ એટેક ગ્રીલ એ રેસ્ટોરન્ટ માટે એકદમ સપાટ બહાનું છે,0,
ખૂબ સીફૂડ નથી અને તળિયે પાસ્તાની 5 સ્ટ્રીંગની જેમ,0,
"સલાડમાં સ્કેલોપને વધુ શક્તિ ન આપવા માટે માત્ર યોગ્ય માત્રામાં ચટણી હતી, જે સંપૂર્ણ રીતે રાંધવામાં આવી હતી",1,
"ફાટેલું કેળું માત્ર ફાટેલું જ નહોતું, પણ પેટ્રીફાઈડ અને સ્વાદહીન હતું",0,
હું તમને 10 મિનિટ સુધી લહેરાવવામાં સંઘર્ષ કરું તે પહેલાં ઓછામાં ઓછું મારું પાણી ફરીથી ભરવાનું વિચારો,0,
કોકટેલ બધી હાથથી બનાવેલી અને સ્વાદિષ્ટ હોય છે,1,
અમે ચોક્કસપણે અહીં પાછા ફરીશું,1,
અમને આ સ્થાન મળ્યું હોવાથી અમે ખૂબ જ ખુશ છીએ,1,
"મહાન ખોરાક અને સેવા, વિશાળ ભાગો અને તેઓ લશ્કરી ડિસ્કાઉન્ટ આપે છે",1,
અમને ખોરાક મળ્યો અને દેખીતી રીતે તેઓએ મીઠું વિશે ક્યારેય સાંભળ્યું ન હતું અને માછલી પર સખત મારપીટ ચાવવાની હતી,0,
એક મહાન સમાપ્ત કરવા માટે એક મહાન માર્ગ,1,
"આ સોદામાં 5 ટેસ્ટિંગ અને 2 ડ્રિંક્સનો સમાવેશ થાય છે, અને જેફ અમારી અપેક્ષા કરતાં વધુ અને આગળ ગયો",1,
#NAME?,1,
સેવા મેહ હતી,0,
"તેમનો મિલ્કશેક મેળવવામાં 30 મિનિટથી વધુ સમય લાગ્યો, જે ચોકલેટ મિલ્ક સિવાય બીજું કંઈ ન હતું",0,
"મને લાગે છે કે મને ખબર હોવી જોઈએ કે આ સ્થાન શોષી લેશે, કારણ કે તે એક્સકેલિબરની અંદર છે, પરંતુ મેં મારી સામાન્ય સમજનો ઉપયોગ કર્યો નથી",0,
સ્કૉલપ વાનગી મૂલ્ય માટે પણ ખૂબ જ ભયાનક છે,0,
શક્કરીયાની ફ્રાઈસ ખૂબ જ સારી અને મસાલેદાર હતી,1,
આજે બીજી વખત હું તેમના લંચ બફેટમાં ગયો છું અને તે ખૂબ સારું હતું,1,
વેગાસમાં એટલું બધું સારું ફૂડ છે કે રાઇસ એન્ડ કંપનીમાં જઈને ખાવાની તક વેડફવા બદલ મને છેતરાયાનો અનુભવ થાય છે,0,
અહીં આવવું એ એક અણગમતા સંબંધનો અનુભવ કરવા જેવું છે જ્યાં બંને પક્ષો અન્ય વ્યક્તિના સંબંધને તોડવા માટે પૂછે તેની રાહ જોઈ શકતા નથી,0,
અંદર ચાલ્યા ગયા અને જગ્યા જૂની ગ્રીસ ટ્રેપ જેવી દુર્ગંધ મારતી હતી અને ત્યાં માત્ર 2 અન્ય લોકો ખાય છે,0,
ટર્કી અને રોસ્ટ બીફ સૌમ્ય હતા,0,
પાન કેક દરેક વ્યક્તિ છ વર્ષના બાળકના તાળવાને અનુરૂપ ખાંડવાળી આફતની જેમ સ્વાદ માટે ઉત્સાહિત છે,0,
મને ફો અને સ્પ્રિંગ રોલ્સ ગમે છે ઓહ ખૂબ જ સ્વાદિષ્ટ તમારે પ્રયાસ કરવો પડશે,1,
નબળું બેટર ટુ મીટ રેશિયો ચિકન ટેન્ડરને ખૂબ જ અસંતોષકારક બનાવે છે,0,
"સારાંશમાં, આ મોટે ભાગે નિરાશાજનક જમવાનો અનુભવ હતો",0,
"તે તમારા મોંમાં ખરેખર સેક્સી પાર્ટી જેવું છે, જ્યાં તમે પાર્ટીમાં સૌથી હોટ વ્યક્તિ સાથે આક્રોશપૂર્વક ફ્લર્ટિંગ કરી રહ્યાં છો",1,
અમે ફરી ક્યારેય નહીં જઈએ,0,
તે સારું ન હતું,0,
"ઉપરની બાજુએ, તેમનું કાફે ખરેખર સારું ભોજન આપે છે",1,
"એકમાત્ર સારી બાબત એ હતી કે અમારો વેઈટર હતો, તે ખૂબ જ મદદગાર હતો અને બ્લોડી મેરીના આવવાને રાખતો હતો",1,
"શહેરમાં શ્રેષ્ઠ બફેટ, કિંમત માટે તમે તેને હરાવી શકતા નથી",1,
"મને આ વાઇનના ઘટાડામાં રાંધવામાં આવેલા તેમના મસલ્સ ગમ્યા, બતક કોમળ હતી, અને તેમના બટાકાની વાનગીઓ સ્વાદિષ્ટ હતી",1,
આ એક શ્રેષ્ઠ બફેટ્સ છે કે જે હું રહ્યો છું,1,
વાતાવરણ અદ્ભુત છે અને ત્યાં સંગીત વગાડવામાં આવે છે,1,
આગળની સફર બહાર પાછા જશે,1,
"વાસ્તવિક સુશી પ્રેમીઓ, ચાલો પ્રમાણિક બનો - યમ તેટલો સારો નથી",0,
"અમારા ઓર્ડર અને ફૂડ પહોંચતા વચ્ચે ઓછામાં ઓછા 40 મિનિટ પસાર થયા, અને તે એટલું વ્યસ્ત ન હતું",0,
સારા ભાવ,1,
તપાસી જુઓ,1,
મારી પાસે વધુ સારું વાતાવરણ હતું,0,
એક ટુકડો ગડબડ કરવા માટે હાર્ડ પ્રકારની પરંતુ તેઓ કર્યું,0,
"જોકે મને આ સ્થળનો દેખાવ અને અવાજ ખૂબ જ ગમ્યો, વાસ્તવિક અનુભવ થોડો નિરાશાજનક હતો",0,
મને ખબર નથી કે જ્યારે તેઓ ભારતીય રાંધણકળા તૈયાર કરી રહ્યા હોય ત્યારે આ સ્થાને મેં ક્યારેય ખાધું હોય તેટલું સૌમ્ય ભોજન પીરસવામાં કેવી રીતે વ્યવસ્થાપિત થઈ,0,
"બુટ કરવા માટે સૌથી ખરાબ સેવા, પરંતુ તે તેમની ચિંતાઓમાં સૌથી ઓછી છે",0,
સેવા સારી હતી અને વેઇટ્રેસ મૈત્રીપૂર્ણ હતી,1,
"બધા લોકો પાસે સ્ટીક હતા, અને અમારા સ્ટીક પ્રેમાળ પુત્ર કે જેણે શ્રેષ્ઠ અને સૌથી ખરાબ સ્થળોએ સ્ટીક ખાધી છે તેણે કહ્યું કે તે અત્યાર સુધી ખાયેલું શ્રેષ્ઠ સ્ટીક હતું",1,
"અમે વિચાર્યું કે સારી સુશી મેળવવા માટે તમારે વધુ દૂર જવું પડશે, પરંતુ આ સ્થાન ખરેખર તે રાત્રે સ્થળ પર આવી ગયું",1,
"અસાધારણ ખોરાક, સેવા અને વાતાવરણ",1,
હું પાછો નહીં ફરું,0,
"ચોક્કસપણે ડુક્કરનું માંસ પેટ માટે સ્ટ્રીપ બોલ venturing વર્થ, હું વેગાસ છું આગલી વખતે પાછા આવશે",1,
આ સ્થાન સાધારણ ખોરાક માટે ખૂબ જ વધુ પડતું છે,0,
"તેમની પાસે મોટા પ્રમાણમાં મીટલોફ સેન્ડવીચ, ક્રિસ્પી ચિકન રેપ, એક સ્વાદિષ્ટ ટુના મેલ્ટ અને કેટલાક સ્વાદિષ્ટ બર્ગર સહિત ખોરાકની સારી પસંદગી છે",1,
મેનેજમેન્ટ અસંસ્કારી છે,0,
"સ્વાદિષ્ટ NYC બેગલ્સ, ક્રીમ ચીઝની સારી પસંદગી, કેપર્સ સાથે વાસ્તવિક Lox પણ",1,
"ગ્રેટ સબવે, વાસ્તવમાં તે ઘણું સારું છે જ્યારે તમે અહીં આવો છો ત્યારે દરેક અન્ય સબવે તમારી અપેક્ષાઓ પૂરી નહીં કરે",1,
મેં અહીં ગંભીર રીતે નક્કર નાસ્તો કર્યો,1,
આ વેગાસમાં ખોરાક સાથેના શ્રેષ્ઠ બારમાંથી એક છે,1,
"તે અત્યંત અસંસ્કારી હતો અને ખરેખર, એવી ઘણી બીજી રેસ્ટોરન્ટ્સ છે જ્યાં મને વેગાસમાં સપ્તાહાંત દરમિયાન જમવાનું ગમશે",0,
મારું પીણું ક્યારેય ખાલી નહોતું અને તેણે કેટલાક ખરેખર મહાન મેનૂ સૂચનો કર્યા,1,
વેઈટર મદદરૂપ કે મૈત્રીપૂર્ણ ન હતો અને ભાગ્યે જ અમારી તપાસ કરવામાં આવે છે,0,
મારા પતિ અને મેં અહીં બપોરનું ભોજન લીધું અને ભોજન અને સેવાથી ખૂબ નિરાશ થયા,0,
અને લાલ કરીમાં વાંસની ઘણી ડાળીઓ હતી અને તે મારા માટે બહુ સ્વાદિષ્ટ ન હતી,0,
ટોચ પર મોઝનો સરસ ધાબળો છે પરંતુ મને લાગે છે કે આ સબપાર ખોરાકને ઢાંકવા માટે કરવામાં આવ્યું હતું,1,
સ્નાનગૃહ સ્વચ્છ છે અને સ્થળ પોતે જ સુશોભિત છે,1,
"મેનૂ હંમેશા બદલાતું રહે છે, ખોરાકની ગુણવત્તા નીચે જઈ રહી છે અને સેવા અત્યંત ધીમી છે",0,
"સેવા થોડી ધીમી હતી, તે ધ્યાનમાં લેતા કે 3 લોકો સર્વર દ્વારા સેવા આપવામાં આવી હતી તેથી ખોરાક ધીમી ગતિએ આવી રહ્યો હતો",0,
અમે અમારા વેઈટરને અન્ય ટેબલો પર વધુ ધ્યાન આપતા અને અમારી અવગણના કરતા જોયા,0,
હું અને મારી મંગેતર દિવસના મધ્યમાં આવ્યા અને અમને તરત જ આવકારવામાં આવ્યા અને બેઠા,1,
મંડલય ખાડી પર આ એક સરસ રેસ્ટોરન્ટ છે,1,
અમે પિસ્તાલીસ મિનિટ સુધી વ્યર્થ રાહ જોઈ,0,
સલાડ સાથે આવેલ ક્રોસ્ટિની વાસી હતી,0,
સ્ટાફ મૈત્રીપૂર્ણ છે અને સંયુક્ત હંમેશા સ્વચ્છ છે,1,
બીજા દિવસના ટુકડા કરતા આ એક અલગ કટ હતો પરંતુ તે હજુ પણ અદ્ભુત અને કોમળ તેમજ સ્વાદયુક્ત છે,1,
મેં વૂડૂ પાસ્તાનો ઓર્ડર આપ્યો હતો અને ઘણા વર્ષો પહેલા ગ્લુટેન મુક્ત થયા પછી મને ખરેખર ઉત્તમ પાસ્તા મળ્યો હતો,1,
આ જગ્યા સારી છે,1,
"દુર્ભાગ્યવશ, અમે બચેલા દિવસે બેકરી પર હુમલો કર્યો હોવો જોઈએ કારણ કે અમે જે બધું ઓર્ડર કર્યું હતું તે વાસી હતું",0,
તેઓ સ્થાનાંતરિત થયા ત્યારથી હું આજે પાછો આવ્યો છું અને હજુ પણ પ્રભાવિત થયો નથી,0,
હું તરત જ બેસી ગયો,1,
"તેમનું મેનૂ વૈવિધ્યસભર છે, અને વ્યાજબી કિંમતે છે",1,
રેસ્ટોરન્ટ હંમેશા ભરેલી હોય છે પરંતુ ક્યારેય રાહ જોવાની નથી,1,
આ સ્થાન ફોનિક્સ મેટ્રો વિસ્તારમાં ખાવા માટેના શ્રેષ્ઠ સ્થાનોમાંથી એક છે,1,
મારી સાથે આટલો ખરાબ વ્યવહાર ક્યારેય થયો નથી,0,
બેકન હેલા ખારી છે,1,
અમે સ્પિનચ અને એવોકાડો કચુંબર પણ મંગાવ્યું; ઘટકો ઉદાસી હતા અને ડ્રેસિંગનો શાબ્દિક સ્વાદ શૂન્ય હતો,0,
